{
  "classifications": [
    {
      "name": "cpu.intel",
      "rules": [
        "test.cpu.intel"
      ],
      "targets": [
        "cpu"
      ]
    },
    {
      "name": "gpu.nvidia",
      "rules": [
        "test.gpu.nvidia"
      ],
      "targets": [
        "pci:0000:01:00.0"
      ]
    },
    {
      "name": "pci.bridge",
      "rules": [
        "test.pci.bridge"
      ],
      "targets": [
        "pci:0000:00:01.0"
      ]
    }
  ],
  "conflicts": [],
  "inventory_digest": "sha256:94b5c4e150ef4108ac6cbbd00b99d34acb3d7f95905701417aa3c590fe05776c",
  "inventory_schema": "lubarchy.hardware.inventory/v1",
  "matched_rules": [
    {
      "id": "test.gpu.nvidia",
      "priority": 200,
      "targets": [
        "pci:0000:01:00.0"
      ]
    },
    {
      "id": "test.cpu.intel",
      "priority": 100,
      "targets": [
        "cpu"
      ]
    },
    {
      "id": "test.pci.bridge",
      "priority": 10,
      "targets": [
        "pci:0000:00:01.0"
      ]
    }
  ],
  "packages": [
    {
      "disposition": "require",
      "name": "lubarchy-test-firmware-a",
      "reasons": [
        {
          "reason": "Synthetic microcode-like requirement from a non-main component.",
          "rule": "test.cpu.intel"
        }
      ],
      "source": "non-free-firmware",
      "source_status": "policy_review_required"
    },
    {
      "disposition": "require",
      "name": "lubarchy-test-firmware-d",
      "reasons": [
        {
          "reason": "Synthetic GPU firmware requirement from a non-main component.",
          "rule": "test.gpu.nvidia"
        }
      ],
      "source": "non-free-firmware",
      "source_status": "policy_review_required"
    }
  ],
  "profiles": [
    {
      "name": "test-graphics-nvidia",
      "reasons": [
        {
          "reason": "Synthetic NVIDIA graphics profile label.",
          "rule": "test.gpu.nvidia"
        }
      ]
    }
  ],
  "rule_schema": "lubarchy.hardware.rule/v1",
  "rule_set_digest": "sha256:199c0b8ffceafb6656e48ad416e69b4fe15b4b86a6bc15e88949677da09cdc8b",
  "schema": "lubarchy.hardware.plan/v1",
  "source_policy": {
    "authorised": [
      "main"
    ]
  },
  "sources": [
    {
      "packages": [
        "lubarchy-test-firmware-a",
        "lubarchy-test-firmware-d"
      ],
      "source": "non-free-firmware",
      "status": "policy_review_required"
    }
  ],
  "status": "partial",
  "unresolved": [],
  "warnings": [
    {
      "code": "test.nvidia-policy-pending",
      "message": "Synthetic test warning: NVIDIA driver sourcing is not decided.",
      "rule": "test.gpu.nvidia"
    }
  ]
}
