{
  "classifications": [],
  "conflicts": [],
  "errors": [
    {
      "check": "additionalProperties",
      "path": "/devices/1"
    }
  ],
  "inventory_schema": "lubarchy.hardware.inventory/v1",
  "matched_rules": [],
  "packages": [],
  "profiles": [],
  "rule_schema": "lubarchy.hardware.rule/v1",
  "rule_set_digest": "sha256:199c0b8ffceafb6656e48ad416e69b4fe15b4b86a6bc15e88949677da09cdc8b",
  "schema": "lubarchy.hardware.plan/v1",
  "source_policy": {
    "authorised": [
      "main"
    ]
  },
  "sources": [],
  "status": "invalid",
  "unresolved": [],
  "warnings": []
}
