{
  "classifications": [
    {
      "name": "cpu.intel",
      "rules": [
        "test.cpu.intel"
      ],
      "targets": [
        "cpu"
      ]
    },
    {
      "name": "gpu.intel",
      "rules": [
        "test.gpu.intel"
      ],
      "targets": [
        "pci:0000:00:02.0"
      ]
    }
  ],
  "conflicts": [],
  "inventory_digest": "sha256:2ca428748a5f3ee436a88fa4be94136f4608aae807ed4291a939493e7f70653f",
  "inventory_schema": "lubarchy.hardware.inventory/v1",
  "matched_rules": [
    {
      "id": "test.gpu.intel",
      "priority": 200,
      "targets": [
        "pci:0000:00:02.0"
      ]
    },
    {
      "id": "test.cpu.intel",
      "priority": 100,
      "targets": [
        "cpu"
      ]
    }
  ],
  "packages": [
    {
      "disposition": "require",
      "name": "lubarchy-test-firmware-a",
      "reasons": [
        {
          "reason": "Synthetic microcode-like requirement from a non-main component.",
          "rule": "test.cpu.intel"
        }
      ],
      "source": "non-free-firmware",
      "source_status": "policy_review_required"
    }
  ],
  "profiles": [
    {
      "name": "test-graphics-open",
      "reasons": [
        {
          "reason": "Synthetic open graphics profile label.",
          "rule": "test.gpu.intel"
        }
      ]
    }
  ],
  "rule_schema": "lubarchy.hardware.rule/v1",
  "rule_set_digest": "sha256:199c0b8ffceafb6656e48ad416e69b4fe15b4b86a6bc15e88949677da09cdc8b",
  "schema": "lubarchy.hardware.plan/v1",
  "source_policy": {
    "authorised": [
      "main"
    ]
  },
  "sources": [
    {
      "packages": [
        "lubarchy-test-firmware-a"
      ],
      "source": "non-free-firmware",
      "status": "policy_review_required"
    }
  ],
  "status": "partial",
  "unresolved": [],
  "warnings": []
}
