{
  "classifications": [
    {
      "name": "cpu.amd",
      "rules": [
        "test.cpu.amd"
      ],
      "targets": [
        "cpu"
      ]
    },
    {
      "name": "gpu.amd",
      "rules": [
        "test.gpu.amd"
      ],
      "targets": [
        "pci:0000:03:00.0"
      ]
    },
    {
      "name": "pci.bridge",
      "rules": [
        "test.pci.bridge"
      ],
      "targets": [
        "pci:0000:00:01.1"
      ]
    }
  ],
  "conflicts": [],
  "inventory_digest": "sha256:68245d81c155f10077d8e3ffe19ce61456b4c687f99edc7e1bd5a56d30f4b7ba",
  "inventory_schema": "lubarchy.hardware.inventory/v1",
  "matched_rules": [
    {
      "id": "test.gpu.amd",
      "priority": 200,
      "targets": [
        "pci:0000:03:00.0"
      ]
    },
    {
      "id": "test.cpu.amd",
      "priority": 100,
      "targets": [
        "cpu"
      ]
    },
    {
      "id": "test.pci.bridge",
      "priority": 10,
      "targets": [
        "pci:0000:00:01.1"
      ]
    }
  ],
  "packages": [
    {
      "disposition": "require",
      "name": "lubarchy-test-firmware-b",
      "reasons": [
        {
          "reason": "Synthetic requirement from main.",
          "rule": "test.cpu.amd"
        }
      ],
      "source": "main",
      "source_status": "authorised"
    },
    {
      "disposition": "require",
      "name": "lubarchy-test-firmware-c",
      "reasons": [
        {
          "reason": "Synthetic GPU firmware requirement from main.",
          "rule": "test.gpu.amd"
        }
      ],
      "source": "main",
      "source_status": "authorised"
    }
  ],
  "profiles": [
    {
      "name": "test-graphics-open",
      "reasons": [
        {
          "reason": "Synthetic open graphics profile label.",
          "rule": "test.gpu.amd"
        }
      ]
    }
  ],
  "rule_schema": "lubarchy.hardware.rule/v1",
  "rule_set_digest": "sha256:199c0b8ffceafb6656e48ad416e69b4fe15b4b86a6bc15e88949677da09cdc8b",
  "schema": "lubarchy.hardware.plan/v1",
  "source_policy": {
    "authorised": [
      "main"
    ]
  },
  "sources": [
    {
      "packages": [
        "lubarchy-test-firmware-b",
        "lubarchy-test-firmware-c"
      ],
      "source": "main",
      "status": "authorised"
    }
  ],
  "status": "resolved",
  "unresolved": [],
  "warnings": []
}
